Last login: Thu Jul 14 14:48:48 on ttys004
hexa-l-musique:~ normandeau$ sudo tcpdump -i lo0
tcpdump: verbose output suppressed, use -v or -vv for full protocol decode
listening on lo0, link-type NULL (BSD loopback), capture size 65535 bytes
14:58:42.443149 IP localhost.57272 > localhost.18032: UDP, length 40
14:58:42.443172 IP localhost.57272 > localhost.18032: UDP, length 40
14:58:42.469205 IP localhost.57272 > localhost.18032: UDP, length 40
14:58:42.469228 IP localhost.57272 > localhost.18032: UDP, length 40
14:58:42.495149 IP localhost.57272 > localhost.18032: UDP, length 40
14:58:42.495175 IP localhost.57272 > localhost.18032: UDP, length 40
14:58:42.530907 IP localhost.57272 > localhost.18032: UDP, length 40
14:58:42.530946 IP localhost.57272 > localhost.18032: UDP, length 40
14:58:42.561196 IP localhost.57272 > localhost.18032: UDP, length 40
14:58:42.561219 IP localhost.57272 > localhost.18032: UDP, length 40
14:58:42.594891 IP localhost.57272 > localhost.18032: UDP, length 40
14:58:42.594925 IP localhost.57272 > localhost.18032: UDP, length 40
14:58:42.628998 IP localhost.57272 > localhost.18032: UDP, length 40
14:58:42.629024 IP localhost.57272 > localhost.18032: UDP, length 40
14:58:42.654199 IP localhost.57272 > localhost.18032: UDP, length 40
14:58:42.654221 IP localhost.57272 > localhost.18032: UDP, length 40
14:58:42.679470 IP localhost.57272 > localhost.18032: UDP, length 40
14:58:42.679496 IP localhost.57272 > localhost.18032: UDP, length 40
14:58:42.705163 IP localhost.57272 > localhost.18032: UDP, length 40
14:58:42.705185 IP localhost.57272 > localhost.18032: UDP, length 40
14:58:42.731181 IP localhost.57272 > localhost.18032: UDP, length 40
14:58:42.731204 IP localhost.57272 > localhost.18032: UDP, length 40
14:58:42.757211 IP localhost.57272 > localhost.18032: UDP, length 40
14:58:42.757301 IP localhost.57272 > localhost.18032: UDP, length 40
14:58:42.783245 IP localhost.57272 > localhost.18032: UDP, length 40
14:58:42.783281 IP localhost.57272 > localhost.18032: UDP, length 40
14:58:42.808571 IP localhost.57272 > localhost.18032: UDP, length 40
14:58:42.808594 IP localhost.57272 > localhost.18032: UDP, length 40
14:58:42.833845 IP localhost.57272 > localhost.18032: UDP, length 40
14:58:42.833876 IP localhost.57272 > localhost.18032: UDP, length 40
14:58:42.859004 IP localhost.57272 > localhost.18032: UDP, length 40
14:58:42.859027 IP localhost.57272 > localhost.18032: UDP, length 40
14:58:42.884232 IP localhost.57272 > localhost.18032: UDP, length 40
14:58:42.884255 IP localhost.57272 > localhost.18032: UDP, length 40
14:58:42.909812 IP localhost.57272 > localhost.18032: UDP, length 40
14:58:42.909849 IP localhost.57272 > localhost.18032: UDP, length 40
14:58:42.935204 IP localhost.57272 > localhost.18032: UDP, length 40
14:58:42.935227 IP localhost.57272 > localhost.18032: UDP, length 40
14:58:42.960456 IP localhost.57272 > localhost.18032: UDP, length 40
14:58:42.960479 IP localhost.57272 > localhost.18032: UDP, length 40
14:58:42.986600 IP localhost.57272 > localhost.18032: UDP, length 40
14:58:42.986663 IP localhost.57272 > localhost.18032: UDP, length 40
14:58:43.011969 IP localhost.57272 > localhost.18032: UDP, length 40
14:58:43.012006 IP localhost.57272 > localhost.18032: UDP, length 40
14:58:43.037199 IP localhost.57272 > localhost.18032: UDP, length 40
14:58:43.037224 IP localhost.57272 > localhost.18032: UDP, length 40
14:58:43.063246 IP localhost.57272 > localhost.18032: UDP, length 40
14:58:43.063270 IP localhost.57272 > localhost.18032: UDP, length 40
14:58:43.088461 IP localhost.57272 > localhost.18032: UDP, length 40
14:58:43.088484 IP localhost.57272 > localhost.18032: UDP, length 40
14:58:43.114462 IP localhost.57272 > localhost.18032: UDP, length 40
14:58:43.114492 IP localhost.57272 > localhost.18032: UDP, length 40
14:58:43.140077 IP localhost.57272 > localhost.18032: UDP, length 40
14:58:43.140100 IP localhost.57272 > localhost.18032: UDP, length 40
14:58:43.165372 IP localhost.57272 > localhost.18032: UDP, length 40
14:58:43.165404 IP localhost.57272 > localhost.18032: UDP, length 40
14:58:43.190715 IP localhost.57272 > localhost.18032: UDP, length 40
14:58:43.190737 IP localhost.57272 > localhost.18032: UDP, length 40
14:58:43.215900 IP localhost.57272 > localhost.18032: UDP, length 40
14:58:43.215927 IP localhost.57272 > localhost.18032: UDP, length 40
14:58:43.241892 IP localhost.57272 > localhost.18032: UDP, length 40
14:58:43.241935 IP localhost.57272 > localhost.18032: UDP, length 40
14:58:43.267091 IP localhost.57272 > localhost.18032: UDP, length 40
14:58:43.267114 IP localhost.57272 > localhost.18032: UDP, length 40
14:58:43.292313 IP localhost.57272 > localhost.18032: UDP, length 40
14:58:43.292348 IP localhost.57272 > localhost.18032: UDP, length 40
14:58:43.319553 IP localhost.57272 > localhost.18032: UDP, length 40
14:58:43.319576 IP localhost.57272 > localhost.18032: UDP, length 40
14:58:43.345276 IP localhost.57272 > localhost.18032: UDP, length 40
14:58:43.345304 IP localhost.57272 > localhost.18032: UDP, length 40
14:58:43.370557 IP localhost.57272 > localhost.18032: UDP, length 40
14:58:43.370649 IP localhost.57272 > localhost.18032: UDP, length 40
14:58:43.396311 IP localhost.57272 > localhost.18032: UDP, length 40
14:58:43.396362 IP localhost.57272 > localhost.18032: UDP, length 40
14:58:43.422201 IP localhost.57272 > localhost.18032: UDP, length 40
14:58:43.422234 IP localhost.57272 > localhost.18032: UDP, length 40
14:58:43.448152 IP localhost.57272 > localhost.18032: UDP, length 40
14:58:43.448188 IP localhost.57272 > localhost.18032: UDP, length 40
14:58:43.473408 IP localhost.57272 > localhost.18032: UDP, length 40
14:58:43.473436 IP localhost.57272 > localhost.18032: UDP, length 40
14:58:43.499698 IP localhost.57272 > localhost.18032: UDP, length 40
14:58:43.499721 IP localhost.57272 > localhost.18032: UDP, length 40
14:58:43.524911 IP localhost.57272 > localhost.18032: UDP, length 40
14:58:43.524936 IP localhost.57272 > localhost.18032: UDP, length 40
14:58:43.550221 IP localhost.57272 > localhost.18032: UDP, length 40
14:58:43.550244 IP localhost.57272 > localhost.18032: UDP, length 40
14:58:43.576252 IP localhost.57272 > localhost.18032: UDP, length 40
14:58:43.576274 IP localhost.57272 > localhost.18032: UDP, length 40
14:58:43.601530 IP localhost.57272 > localhost.18032: UDP, length 40
14:58:43.601562 IP localhost.57272 > localhost.18032: UDP, length 40
14:58:43.628324 IP localhost.57272 > localhost.18032: UDP, length 40
14:58:43.628346 IP localhost.57272 > localhost.18032: UDP, length 40
14:58:43.653632 IP localhost.57272 > localhost.18032: UDP, length 40
14:58:43.653654 IP localhost.57272 > localhost.18032: UDP, length 40
14:58:43.679843 IP localhost.57272 > localhost.18032: UDP, length 40
14:58:43.679871 IP localhost.57272 > localhost.18032: UDP, length 40
14:58:43.705033 IP localhost.57272 > localhost.18032: UDP, length 40
14:58:43.705061 IP localhost.57272 > localhost.18032: UDP, length 40
14:58:43.730263 IP localhost.57272 > localhost.18032: UDP, length 40
14:58:43.730288 IP localhost.57272 > localhost.18032: UDP, length 40
14:58:43.756133 IP localhost.57272 > localhost.18032: UDP, length 40
14:58:43.756156 IP localhost.57272 > localhost.18032: UDP, length 40
14:58:43.782141 IP localhost.57272 > localhost.18032: UDP, length 40
14:58:43.782174 IP localhost.57272 > localhost.18032: UDP, length 40
14:58:43.808254 IP localhost.57272 > localhost.18032: UDP, length 40
14:58:43.808278 IP localhost.57272 > localhost.18032: UDP, length 40
14:58:43.833513 IP localhost.57272 > localhost.18032: UDP, length 40
14:58:43.833541 IP localhost.57272 > localhost.18032: UDP, length 40
14:58:43.860044 IP localhost.57272 > localhost.18032: UDP, length 40
14:58:43.860066 IP localhost.57272 > localhost.18032: UDP, length 40
14:58:43.885250 IP localhost.57272 > localhost.18032: UDP, length 40
14:58:43.885281 IP localhost.57272 > localhost.18032: UDP, length 40
14:58:43.911154 IP localhost.57272 > localhost.18032: UDP, length 40
14:58:43.911176 IP localhost.57272 > localhost.18032: UDP, length 40
14:58:43.937244 IP localhost.57272 > localhost.18032: UDP, length 40
14:58:43.937282 IP localhost.57272 > localhost.18032: UDP, length 40
14:58:43.962644 IP localhost.57272 > localhost.18032: UDP, length 40
14:58:43.962665 IP localhost.57272 > localhost.18032: UDP, length 40
14:58:43.988093 IP localhost.57272 > localhost.18032: UDP, length 40
14:58:43.988117 IP localhost.57272 > localhost.18032: UDP, length 40
14:58:44.014190 IP localhost.57272 > localhost.18032: UDP, length 40
14:58:44.014225 IP localhost.57272 > localhost.18032: UDP, length 40
14:58:44.039507 IP localhost.57272 > localhost.18032: UDP, length 40
14:58:44.039529 IP localhost.57272 > localhost.18032: UDP, length 40
14:58:44.065169 IP localhost.57272 > localhost.18032: UDP, length 40
14:58:44.065192 IP localhost.57272 > localhost.18032: UDP, length 40
14:58:44.091163 IP localhost.57272 > localhost.18032: UDP, length 40
14:58:44.091195 IP localhost.57272 > localhost.18032: UDP, length 40
14:58:44.120543 IP localhost.57272 > localhost.18032: UDP, length 40
14:58:44.120568 IP localhost.57272 > localhost.18032: UDP, length 40
14:58:44.145705 IP localhost.57272 > localhost.18032: UDP, length 40
14:58:44.145778 IP localhost.57272 > localhost.18032: UDP, length 40
14:58:44.171596 IP localhost.57272 > localhost.18032: UDP, length 40
14:58:44.171621 IP localhost.57272 > localhost.18032: UDP, length 40
14:58:44.196853 IP localhost.57272 > localhost.18032: UDP, length 40
14:58:44.196880 IP localhost.57272 > localhost.18032: UDP, length 40
14:58:44.223035 IP localhost.57272 > localhost.18032: UDP, length 40
14:58:44.223064 IP localhost.57272 > localhost.18032: UDP, length 40
14:58:44.249405 IP localhost.57272 > localhost.18032: UDP, length 40
14:58:44.249433 IP localhost.57272 > localhost.18032: UDP, length 40
14:58:44.275157 IP localhost.57272 > localhost.18032: UDP, length 40
14:58:44.275178 IP localhost.57272 > localhost.18032: UDP, length 40
14:58:44.301070 IP localhost.57272 > localhost.18032: UDP, length 40
14:58:44.301093 IP localhost.57272 > localhost.18032: UDP, length 40
14:58:44.326355 IP localhost.57272 > localhost.18032: UDP, length 40
14:58:44.326394 IP localhost.57272 > localhost.18032: UDP, length 40
14:58:44.352067 IP localhost.57272 > localhost.18032: UDP, length 40
14:58:44.352151 IP localhost.57272 > localhost.18032: UDP, length 40
14:58:44.377346 IP localhost.57272 > localhost.18032: UDP, length 40
14:58:44.377376 IP localhost.57272 > localhost.18032: UDP, length 40
14:58:44.403167 IP localhost.57272 > localhost.18032: UDP, length 40
14:58:44.403199 IP localhost.57272 > localhost.18032: UDP, length 40
14:58:44.432221 IP localhost.57272 > localhost.18032: UDP, length 40
14:58:44.432244 IP localhost.57272 > localhost.18032: UDP, length 40
14:58:44.458169 IP localhost.57272 > localhost.18032: UDP, length 40
14:58:44.458191 IP localhost.57272 > localhost.18032: UDP, length 40
14:58:44.484134 IP localhost.57272 > localhost.18032: UDP, length 40
14:58:44.484157 IP localhost.57272 > localhost.18032: UDP, length 40
14:58:44.509440 IP localhost.57272 > localhost.18032: UDP, length 40
14:58:44.509468 IP localhost.57272 > localhost.18032: UDP, length 40
14:58:44.538074 IP localhost.57272 > localhost.18032: UDP, length 40
14:58:44.538102 IP localhost.57272 > localhost.18032: UDP, length 40
14:58:44.563434 IP localhost.57272 > localhost.18032: UDP, length 40
14:58:44.563474 IP localhost.57272 > localhost.18032: UDP, length 40
14:58:44.588772 IP localhost.57272 > localhost.18032: UDP, length 40
14:58:44.588795 IP localhost.57272 > localhost.18032: UDP, length 40
14:58:44.614108 IP localhost.57272 > localhost.18032: UDP, length 40
14:58:44.614145 IP localhost.57272 > localhost.18032: UDP, length 40
14:58:44.641272 IP localhost.57272 > localhost.18032: UDP, length 40
14:58:44.641300 IP localhost.57272 > localhost.18032: UDP, length 40
14:58:44.666530 IP localhost.57272 > localhost.18032: UDP, length 40
14:58:44.666558 IP localhost.57272 > localhost.18032: UDP, length 40
14:58:44.692335 IP localhost.57272 > localhost.18032: UDP, length 40
14:58:44.692358 IP localhost.57272 > localhost.18032: UDP, length 40
14:58:44.717661 IP localhost.57272 > localhost.18032: UDP, length 40
14:58:44.717684 IP localhost.57272 > localhost.18032: UDP, length 40
14:58:44.743216 IP localhost.57272 > localhost.18032: UDP, length 40
14:58:44.743239 IP localhost.57272 > localhost.18032: UDP, length 40
14:58:44.768481 IP localhost.57272 > localhost.18032: UDP, length 40
14:58:44.768514 IP localhost.57272 > localhost.18032: UDP, length 40
14:58:44.794504 IP localhost.57272 > localhost.18032: UDP, length 40
14:58:44.794526 IP localhost.57272 > localhost.18032: UDP, length 40
14:58:44.819801 IP localhost.57272 > localhost.18032: UDP, length 40
14:58:44.819825 IP localhost.57272 > localhost.18032: UDP, length 40
14:58:44.845034 IP localhost.57272 > localhost.18032: UDP, length 40
14:58:44.845057 IP localhost.57272 > localhost.18032: UDP, length 40
14:58:44.871202 IP localhost.57272 > localhost.18032: UDP, length 40
14:58:44.871224 IP localhost.57272 > localhost.18032: UDP, length 40
14:58:44.897330 IP localhost.57272 > localhost.18032: UDP, length 40
14:58:44.897419 IP localhost.57272 > localhost.18032: UDP, length 40
14:58:44.923183 IP localhost.57272 > localhost.18032: UDP, length 40
14:58:44.923217 IP localhost.57272 > localhost.18032: UDP, length 40
14:58:44.949308 IP localhost.57272 > localhost.18032: UDP, length 40
14:58:44.949385 IP localhost.57272 > localhost.18032: UDP, length 40
14:58:44.975194 IP localhost.57272 > localhost.18032: UDP, length 40
14:58:44.975217 IP localhost.57272 > localhost.18032: UDP, length 40
14:58:45.001293 IP localhost.57272 > localhost.18032: UDP, length 40
14:58:45.001316 IP localhost.57272 > localhost.18032: UDP, length 40
14:58:45.026459 IP localhost.57272 > localhost.18032: UDP, length 40
14:58:45.026486 IP localhost.57272 > localhost.18032: UDP, length 40
14:58:45.051796 IP localhost.57272 > localhost.18032: UDP, length 40
14:58:45.051839 IP localhost.57272 > localhost.18032: UDP, length 40
14:58:45.077274 IP localhost.57272 > localhost.18032: UDP, length 40
14:58:45.077383 IP localhost.57272 > localhost.18032: UDP, length 40
14:58:45.103189 IP localhost.57272 > localhost.18032: UDP, length 40
14:58:45.103217 IP localhost.57272 > localhost.18032: UDP, length 40
14:58:45.128426 IP localhost.57272 > localhost.18032: UDP, length 40
14:58:45.128449 IP localhost.57272 > localhost.18032: UDP, length 40
14:58:45.154199 IP localhost.57272 > localhost.18032: UDP, length 40
14:58:45.154238 IP localhost.57272 > localhost.18032: UDP, length 40
14:58:45.179969 IP localhost.57272 > localhost.18032: UDP, length 40
14:58:45.179993 IP localhost.57272 > localhost.18032: UDP, length 40
14:58:45.206138 IP localhost.57272 > localhost.18032: UDP, length 40
14:58:45.206161 IP localhost.57272 > localhost.18032: UDP, length 40
14:58:45.231571 IP localhost.57272 > localhost.18032: UDP, length 40
14:58:45.231603 IP localhost.57272 > localhost.18032: UDP, length 40
14:58:45.256948 IP localhost.57272 > localhost.18032: UDP, length 40
14:58:45.256980 IP localhost.57272 > localhost.18032: UDP, length 40
14:58:45.282208 IP localhost.57272 > localhost.18032: UDP, length 40
14:58:45.282236 IP localhost.57272 > localhost.18032: UDP, length 40
14:58:45.308223 IP localhost.57272 > localhost.18032: UDP, length 40
14:58:45.308245 IP localhost.57272 > localhost.18032: UDP, length 40
14:58:45.333607 IP localhost.57272 > localhost.18032: UDP, length 40
14:58:45.333631 IP localhost.57272 > localhost.18032: UDP, length 40
14:58:45.359392 IP localhost.57272 > localhost.18032: UDP, length 40
14:58:45.359456 IP localhost.57272 > localhost.18032: UDP, length 40
14:58:45.384709 IP localhost.57272 > localhost.18032: UDP, length 40
14:58:45.384731 IP localhost.57272 > localhost.18032: UDP, length 40
14:58:45.410142 IP localhost.57272 > localhost.18032: UDP, length 40
14:58:45.410169 IP localhost.57272 > localhost.18032: UDP, length 40
14:58:45.435342 IP localhost.57272 > localhost.18032: UDP, length 40
14:58:45.435445 IP localhost.57272 > localhost.18032: UDP, length 40
14:58:45.461318 IP localhost.57272 > localhost.18032: UDP, length 40
14:58:45.461398 IP localhost.57272 > localhost.18032: UDP, length 40
14:58:45.486581 IP localhost.57272 > localhost.18032: UDP, length 40
14:58:45.486605 IP localhost.57272 > localhost.18032: UDP, length 40
14:58:45.512185 IP localhost.57272 > localhost.18032: UDP, length 40
14:58:45.512209 IP localhost.57272 > localhost.18032: UDP, length 40
14:58:45.537463 IP localhost.57272 > localhost.18032: UDP, length 40
14:58:45.537485 IP localhost.57272 > localhost.18032: UDP, length 40
14:58:45.562813 IP localhost.57272 > localhost.18032: UDP, length 40
14:58:45.562836 IP localhost.57272 > localhost.18032: UDP, length 40
14:58:45.588094 IP localhost.57272 > localhost.18032: UDP, length 40
14:58:45.588117 IP localhost.57272 > localhost.18032: UDP, length 40
14:58:45.614144 IP localhost.57272 > localhost.18032: UDP, length 40
14:58:45.614168 IP localhost.57272 > localhost.18032: UDP, length 40
14:58:45.639408 IP localhost.57272 > localhost.18032: UDP, length 40
14:58:45.639436 IP localhost.57272 > localhost.18032: UDP, length 40
14:58:45.665262 IP localhost.57272 > localhost.18032: UDP, length 40
14:58:45.665284 IP localhost.57272 > localhost.18032: UDP, length 40
14:58:45.691217 IP localhost.57272 > localhost.18032: UDP, length 40
14:58:45.691239 IP localhost.57272 > localhost.18032: UDP, length 40
14:58:45.717293 IP localhost.57272 > localhost.18032: UDP, length 40
14:58:45.717374 IP localhost.57272 > localhost.18032: UDP, length 40
14:58:45.743129 IP localhost.57272 > localhost.18032: UDP, length 40
14:58:45.743152 IP localhost.57272 > localhost.18032: UDP, length 40
14:58:45.768750 IP localhost.57272 > localhost.18032: UDP, length 40
14:58:45.768777 IP localhost.57272 > localhost.18032: UDP, length 40
14:58:45.794070 IP localhost.57272 > localhost.18032: UDP, length 40
14:58:45.794093 IP localhost.57272 > localhost.18032: UDP, length 40
14:58:45.819361 IP localhost.57272 > localhost.18032: UDP, length 40
14:58:45.819391 IP localhost.57272 > localhost.18032: UDP, length 40
14:58:45.845227 IP localhost.57272 > localhost.18032: UDP, length 40
14:58:45.845252 IP localhost.57272 > localhost.18032: UDP, length 40
14:58:45.870573 IP localhost.57272 > localhost.18032: UDP, length 40
14:58:45.870597 IP localhost.57272 > localhost.18032: UDP, length 40
14:58:45.895818 IP localhost.57272 > localhost.18032: UDP, length 40
14:58:45.895851 IP localhost.57272 > localhost.18032: UDP, length 40
14:58:45.921219 IP localhost.57272 > localhost.18032: UDP, length 40
14:58:45.921241 IP localhost.57272 > localhost.18032: UDP, length 40
14:58:45.946587 IP localhost.57272 > localhost.18032: UDP, length 40
14:58:45.946610 IP localhost.57272 > localhost.18032: UDP, length 40
14:58:45.972172 IP localhost.57272 > localhost.18032: UDP, length 40
14:58:45.972194 IP localhost.57272 > localhost.18032: UDP, length 40
14:58:45.997461 IP localhost.57272 > localhost.18032: UDP, length 40
14:58:45.997495 IP localhost.57272 > localhost.18032: UDP, length 40
14:58:46.022742 IP localhost.57272 > localhost.18032: UDP, length 40
14:58:46.022767 IP localhost.57272 > localhost.18032: UDP, length 40
14:58:46.048115 IP localhost.57272 > localhost.18032: UDP, length 40
14:58:46.048141 IP localhost.57272 > localhost.18032: UDP, length 40
14:58:46.074229 IP localhost.57272 > localhost.18032: UDP, length 40
14:58:46.074254 IP localhost.57272 > localhost.18032: UDP, length 40
14:58:46.100254 IP localhost.57272 > localhost.18032: UDP, length 40
14:58:46.100285 IP localhost.57272 > localhost.18032: UDP, length 40
14:58:46.126270 IP localhost.57272 > localhost.18032: UDP, length 40
14:58:46.126293 IP localhost.57272 > localhost.18032: UDP, length 40
14:58:46.151605 IP localhost.57272 > localhost.18032: UDP, length 40
14:58:46.151628 IP localhost.57272 > localhost.18032: UDP, length 40
14:58:46.177653 IP localhost.57272 > localhost.18032: UDP, length 40
14:58:46.177678 IP localhost.57272 > localhost.18032: UDP, length 40
14:58:46.204085 IP localhost.57272 > localhost.18032: UDP, length 40
14:58:46.204125 IP localhost.57272 > localhost.18032: UDP, length 40
14:58:46.230146 IP localhost.57272 > localhost.18032: UDP, length 40
14:58:46.230169 IP localhost.57272 > localhost.18032: UDP, length 40
14:58:46.256244 IP localhost.57272 > localhost.18032: UDP, length 40
14:58:46.256266 IP localhost.57272 > localhost.18032: UDP, length 40
14:58:46.282245 IP localhost.57272 > localhost.18032: UDP, length 40
14:58:46.282267 IP localhost.57272 > localhost.18032: UDP, length 40
14:58:46.307587 IP localhost.57272 > localhost.18032: UDP, length 40
14:58:46.307610 IP localhost.57272 > localhost.18032: UDP, length 40
14:58:46.332855 IP localhost.57272 > localhost.18032: UDP, length 40
14:58:46.332886 IP localhost.57272 > localhost.18032: UDP, length 40
14:58:46.358218 IP localhost.57272 > localhost.18032: UDP, length 40
14:58:46.358247 IP localhost.57272 > localhost.18032: UDP, length 40
14:58:46.383483 IP localhost.57272 > localhost.18032: UDP, length 40
14:58:46.383505 IP localhost.57272 > localhost.18032: UDP, length 40
14:58:46.409330 IP localhost.57272 > localhost.18032: UDP, length 40
14:58:46.409354 IP localhost.57272 > localhost.18032: UDP, length 40
14:58:46.434629 IP localhost.57272 > localhost.18032: UDP, length 40
14:58:46.434654 IP localhost.57272 > localhost.18032: UDP, length 40
14:58:46.460050 IP localhost.57272 > localhost.18032: UDP, length 40
14:58:46.460077 IP localhost.57272 > localhost.18032: UDP, length 40
14:58:46.485589 IP localhost.57272 > localhost.18032: UDP, length 40
14:58:46.485613 IP localhost.57272 > localhost.18032: UDP, length 40
14:58:46.510856 IP localhost.57272 > localhost.18032: UDP, length 40
14:58:46.510880 IP localhost.57272 > localhost.18032: UDP, length 40
14:58:46.542734 IP localhost.57272 > localhost.18032: UDP, length 40
14:58:46.542756 IP localhost.57272 > localhost.18032: UDP, length 40
14:58:46.568124 IP localhost.57272 > localhost.18032: UDP, length 40
14:58:46.568152 IP localhost.57272 > localhost.18032: UDP, length 40
14:58:46.594227 IP localhost.57272 > localhost.18032: UDP, length 40
14:58:46.594249 IP localhost.57272 > localhost.18032: UDP, length 40
14:58:46.620387 IP localhost.57272 > localhost.18032: UDP, length 40
14:58:46.620412 IP localhost.57272 > localhost.18032: UDP, length 40
14:58:46.646548 IP localhost.57272 > localhost.18032: UDP, length 40
14:58:46.646576 IP localhost.57272 > localhost.18032: UDP, length 40
14:58:46.672135 IP localhost.57272 > localhost.18032: UDP, length 40
14:58:46.672157 IP localhost.57272 > localhost.18032: UDP, length 40
14:58:46.697323 IP localhost.57272 > localhost.18032: UDP, length 40
14:58:46.697353 IP localhost.57272 > localhost.18032: UDP, length 40
14:58:46.723202 IP localhost.57272 > localhost.18032: UDP, length 40
14:58:46.723233 IP localhost.57272 > localhost.18032: UDP, length 40
14:58:46.749131 IP localhost.57272 > localhost.18032: UDP, length 40
14:58:46.749154 IP localhost.57272 > localhost.18032: UDP, length 40
14:58:46.775133 IP localhost.57272 > localhost.18032: UDP, length 40
14:58:46.775157 IP localhost.57272 > localhost.18032: UDP, length 40
14:58:46.800379 IP localhost.57272 > localhost.18032: UDP, length 40
14:58:46.800404 IP localhost.57272 > localhost.18032: UDP, length 40
14:58:46.826617 IP localhost.57272 > localhost.18032: UDP, length 40
14:58:46.826700 IP localhost.57272 > localhost.18032: UDP, length 40
14:58:46.852147 IP localhost.57272 > localhost.18032: UDP, length 40
14:58:46.852170 IP localhost.57272 > localhost.18032: UDP, length 40
14:58:46.878136 IP localhost.57272 > localhost.18032: UDP, length 40
14:58:46.878159 IP localhost.57272 > localhost.18032: UDP, length 40
14:58:46.903293 IP localhost.57272 > localhost.18032: UDP, length 40
14:58:46.903317 IP localhost.57272 > localhost.18032: UDP, length 40
14:58:46.928641 IP localhost.57272 > localhost.18032: UDP, length 40
14:58:46.928671 IP localhost.57272 > localhost.18032: UDP, length 40
14:58:46.954500 IP localhost.57272 > localhost.18032: UDP, length 40
14:58:46.954537 IP localhost.57272 > localhost.18032: UDP, length 40
14:58:46.980146 IP localhost.57272 > localhost.18032: UDP, length 40
14:58:46.980169 IP localhost.57272 > localhost.18032: UDP, length 40
14:58:47.006196 IP localhost.57272 > localhost.18032: UDP, length 40
14:58:47.006262 IP localhost.57272 > localhost.18032: UDP, length 40
14:58:47.031503 IP localhost.57272 > localhost.18032: UDP, length 40
14:58:47.031526 IP localhost.57272 > localhost.18032: UDP, length 40
14:58:47.057109 IP localhost.57272 > localhost.18032: UDP, length 40
14:58:47.057146 IP localhost.57272 > localhost.18032: UDP, length 40
14:58:47.083080 IP localhost.57272 > localhost.18032: UDP, length 40
14:58:47.083115 IP localhost.57272 > localhost.18032: UDP, length 40
14:58:47.108376 IP localhost.57272 > localhost.18032: UDP, length 40
14:58:47.108398 IP localhost.57272 > localhost.18032: UDP, length 40
14:58:47.133647 IP localhost.57272 > localhost.18032: UDP, length 40
14:58:47.133672 IP localhost.57272 > localhost.18032: UDP, length 40
14:58:47.262080 IP localhost.57272 > localhost.18032: UDP, length 40
14:58:47.262104 IP localhost.57272 > localhost.18032: UDP, length 40
14:58:47.314554 IP localhost.57272 > localhost.18032: UDP, length 40
14:58:47.314605 IP localhost.57272 > localhost.18032: UDP, length 40
14:58:47.346306 IP localhost.57272 > localhost.18032: UDP, length 40
14:58:47.346344 IP localhost.57272 > localhost.18032: UDP, length 40
14:58:47.378388 IP localhost.57272 > localhost.18032: UDP, length 40
14:58:47.378412 IP localhost.57272 > localhost.18032: UDP, length 40
14:58:47.404164 IP localhost.57272 > localhost.18032: UDP, length 40
14:58:47.404186 IP localhost.57272 > localhost.18032: UDP, length 40
14:58:47.430174 IP localhost.57272 > localhost.18032: UDP, length 40
14:58:47.430196 IP localhost.57272 > localhost.18032: UDP, length 40
14:58:47.456027 IP localhost.57272 > localhost.18032: UDP, length 40
14:58:47.456053 IP localhost.57272 > localhost.18032: UDP, length 40
14:58:47.482159 IP localhost.57272 > localhost.18032: UDP, length 40
14:58:47.482182 IP localhost.57272 > localhost.18032: UDP, length 40
14:58:47.507392 IP localhost.57272 > localhost.18032: UDP, length 40
14:58:47.507415 IP localhost.57272 > localhost.18032: UDP, length 40
14:58:47.533165 IP localhost.57272 > localhost.18032: UDP, length 40
14:58:47.533188 IP localhost.57272 > localhost.18032: UDP, length 40
14:58:47.558459 IP localhost.57272 > localhost.18032: UDP, length 40
14:58:47.558507 IP localhost.57272 > localhost.18032: UDP, length 40
14:58:47.584173 IP localhost.57272 > localhost.18032: UDP, length 40
14:58:47.584199 IP localhost.57272 > localhost.18032: UDP, length 40
14:58:47.609395 IP localhost.57272 > localhost.18032: UDP, length 40
14:58:47.609418 IP localhost.57272 > localhost.18032: UDP, length 40
14:58:47.634654 IP localhost.57272 > localhost.18032: UDP, length 40
14:58:47.634678 IP localhost.57272 > localhost.18032: UDP, length 40
14:58:47.659819 IP localhost.57272 > localhost.18032: UDP, length 40
14:58:47.659843 IP localhost.57272 > localhost.18032: UDP, length 40
14:58:47.685430 IP localhost.57272 > localhost.18032: UDP, length 40
14:58:47.685458 IP localhost.57272 > localhost.18032: UDP, length 40
14:58:47.711207 IP localhost.57272 > localhost.18032: UDP, length 40
14:58:47.711230 IP localhost.57272 > localhost.18032: UDP, length 40
14:58:47.736475 IP localhost.57272 > localhost.18032: UDP, length 40
14:58:47.736502 IP localhost.57272 > localhost.18032: UDP, length 40
14:58:47.764797 IP localhost.57272 > localhost.18032: UDP, length 40
14:58:47.764819 IP localhost.57272 > localhost.18032: UDP, length 40
14:58:47.790055 IP localhost.57272 > localhost.18032: UDP, length 40
14:58:47.790079 IP localhost.57272 > localhost.18032: UDP, length 40
14:58:47.815307 IP localhost.57272 > localhost.18032: UDP, length 40
14:58:47.815339 IP localhost.57272 > localhost.18032: UDP, length 40
14:58:47.840870 IP localhost.57272 > localhost.18032: UDP, length 40
14:58:47.840913 IP localhost.57272 > localhost.18032: UDP, length 40
14:58:47.866059 IP localhost.57272 > localhost.18032: UDP, length 40
14:58:47.866081 IP localhost.57272 > localhost.18032: UDP, length 40
14:58:47.892125 IP localhost.57272 > localhost.18032: UDP, length 40
14:58:47.892152 IP localhost.57272 > localhost.18032: UDP, length 40
14:58:47.918183 IP localhost.57272 > localhost.18032: UDP, length 40
14:58:47.918217 IP localhost.57272 > localhost.18032: UDP, length 40
14:58:47.945556 IP localhost.57272 > localhost.18032: UDP, length 40
14:58:47.945580 IP localhost.57272 > localhost.18032: UDP, length 40
14:58:47.971461 IP localhost.57272 > localhost.18032: UDP, length 40
14:58:47.971483 IP localhost.57272 > localhost.18032: UDP, length 40
14:58:47.997006 IP localhost.57272 > localhost.18032: UDP, length 40
14:58:47.997028 IP localhost.57272 > localhost.18032: UDP, length 40
14:58:48.022236 IP localhost.57272 > localhost.18032: UDP, length 40
14:58:48.022288 IP localhost.57272 > localhost.18032: UDP, length 40
14:58:48.048183 IP localhost.57272 > localhost.18032: UDP, length 40
14:58:48.048210 IP localhost.57272 > localhost.18032: UDP, length 40
14:58:48.074188 IP localhost.57272 > localhost.18032: UDP, length 40
14:58:48.074221 IP localhost.57272 > localhost.18032: UDP, length 40
14:58:48.100315 IP localhost.57272 > localhost.18032: UDP, length 40
14:58:48.100338 IP localhost.57272 > localhost.18032: UDP, length 40
14:58:48.126178 IP localhost.57272 > localhost.18032: UDP, length 40
14:58:48.126227 IP localhost.57272 > localhost.18032: UDP, length 40
14:58:48.152195 IP localhost.57272 > localhost.18032: UDP, length 40
14:58:48.152225 IP localhost.57272 > localhost.18032: UDP, length 40
14:58:48.178273 IP localhost.57272 > localhost.18032: UDP, length 40
14:58:48.178297 IP localhost.57272 > localhost.18032: UDP, length 40
14:58:48.203766 IP localhost.57272 > localhost.18032: UDP, length 40
14:58:48.203791 IP localhost.57272 > localhost.18032: UDP, length 40
14:58:48.229126 IP localhost.57272 > localhost.18032: UDP, length 40
14:58:48.229148 IP localhost.57272 > localhost.18032: UDP, length 40
14:58:48.255225 IP localhost.57272 > localhost.18032: UDP, length 40
14:58:48.255255 IP localhost.57272 > localhost.18032: UDP, length 40
14:58:48.281199 IP localhost.57272 > localhost.18032: UDP, length 40
14:58:48.281227 IP localhost.57272 > localhost.18032: UDP, length 40
14:58:48.306431 IP localhost.57272 > localhost.18032: UDP, length 40
14:58:48.306454 IP localhost.57272 > localhost.18032: UDP, length 40
14:58:48.332175 IP localhost.57272 > localhost.18032: UDP, length 40
14:58:48.332199 IP localhost.57272 > localhost.18032: UDP, length 40
14:58:48.358307 IP localhost.57272 > localhost.18032: UDP, length 40
14:58:48.358330 IP localhost.57272 > localhost.18032: UDP, length 40
14:58:48.383997 IP localhost.57272 > localhost.18032: UDP, length 40
14:58:48.384032 IP localhost.57272 > localhost.18032: UDP, length 40
14:58:48.409305 IP localhost.57272 > localhost.18032: UDP, length 40
14:58:48.409334 IP localhost.57272 > localhost.18032: UDP, length 40
14:58:48.435125 IP localhost.57272 > localhost.18032: UDP, length 40
14:58:48.435173 IP localhost.57272 > localhost.18032: UDP, length 40
14:58:48.460453 IP localhost.57272 > localhost.18032: UDP, length 40
14:58:48.460477 IP localhost.57272 > localhost.18032: UDP, length 40
14:58:48.485691 IP localhost.57272 > localhost.18032: UDP, length 40
14:58:48.485726 IP localhost.57272 > localhost.18032: UDP, length 40
14:58:48.517779 IP localhost.57272 > localhost.18032: UDP, length 40
14:58:48.517803 IP localhost.57272 > localhost.18032: UDP, length 40
14:58:48.548988 IP localhost.57272 > localhost.18032: UDP, length 40
14:58:48.549051 IP localhost.57272 > localhost.18032: UDP, length 40
14:58:48.574301 IP localhost.57272 > localhost.18032: UDP, length 40
14:58:48.574325 IP localhost.57272 > localhost.18032: UDP, length 40
14:58:55.618552 IP localhost.62168 > localhost.18032: UDP, length 40
14:58:55.618581 IP localhost.62168 > localhost.18032: UDP, length 40
14:58:55.646220 IP localhost.62168 > localhost.18032: UDP, length 40
14:58:55.646272 IP localhost.62168 > localhost.18032: UDP, length 40
14:58:55.677946 IP localhost.62168 > localhost.18032: UDP, length 40
14:58:55.677979 IP localhost.62168 > localhost.18032: UDP, length 40
14:58:55.709088 IP localhost.62168 > localhost.18032: UDP, length 40
14:58:55.709111 IP localhost.62168 > localhost.18032: UDP, length 40
14:58:55.734683 IP localhost.62168 > localhost.18032: UDP, length 40
14:58:55.734710 IP localhost.62168 > localhost.18032: UDP, length 40
14:58:55.760157 IP localhost.62168 > localhost.18032: UDP, length 40
14:58:55.760180 IP localhost.62168 > localhost.18032: UDP, length 40
14:58:55.786157 IP localhost.62168 > localhost.18032: UDP, length 40
14:58:55.786181 IP localhost.62168 > localhost.18032: UDP, length 40
14:58:55.811356 IP localhost.62168 > localhost.18032: UDP, length 40
14:58:55.811378 IP localhost.62168 > localhost.18032: UDP, length 40
14:58:55.837194 IP localhost.62168 > localhost.18032: UDP, length 40
14:58:55.837242 IP localhost.62168 > localhost.18032: UDP, length 40
14:58:55.863127 IP localhost.62168 > localhost.18032: UDP, length 40
14:58:55.863154 IP localhost.62168 > localhost.18032: UDP, length 40
14:58:55.890117 IP localhost.62168 > localhost.18032: UDP, length 40
14:58:55.890149 IP localhost.62168 > localhost.18032: UDP, length 40
14:58:55.916184 IP localhost.62168 > localhost.18032: UDP, length 40
14:58:55.916207 IP localhost.62168 > localhost.18032: UDP, length 40
14:58:55.942137 IP localhost.62168 > localhost.18032: UDP, length 40
14:58:55.942160 IP localhost.62168 > localhost.18032: UDP, length 40
14:58:55.968270 IP localhost.62168 > localhost.18032: UDP, length 40
14:58:55.968297 IP localhost.62168 > localhost.18032: UDP, length 40
14:58:55.993491 IP localhost.62168 > localhost.18032: UDP, length 40
14:58:55.993518 IP localhost.62168 > localhost.18032: UDP, length 40
14:58:56.019116 IP localhost.62168 > localhost.18032: UDP, length 40
14:58:56.019179 IP localhost.62168 > localhost.18032: UDP, length 40
14:58:56.045129 IP localhost.62168 > localhost.18032: UDP, length 40
14:58:56.045152 IP localhost.62168 > localhost.18032: UDP, length 40
14:58:56.071161 IP localhost.62168 > localhost.18032: UDP, length 40
14:58:56.071193 IP localhost.62168 > localhost.18032: UDP, length 40
14:58:56.097098 IP localhost.62168 > localhost.18032: UDP, length 40
14:58:56.097133 IP localhost.62168 > localhost.18032: UDP, length 40
14:58:56.122368 IP localhost.62168 > localhost.18032: UDP, length 40
14:58:56.122396 IP localhost.62168 > localhost.18032: UDP, length 40
14:58:56.148225 IP localhost.62168 > localhost.18032: UDP, length 40
14:58:56.148294 IP localhost.62168 > localhost.18032: UDP, length 40
14:58:56.174218 IP localhost.62168 > localhost.18032: UDP, length 40
14:58:56.174284 IP localhost.62168 > localhost.18032: UDP, length 40
14:58:56.199504 IP localhost.62168 > localhost.18032: UDP, length 40
14:58:56.199526 IP localhost.62168 > localhost.18032: UDP, length 40
14:58:56.225122 IP localhost.62168 > localhost.18032: UDP, length 40
14:58:56.225157 IP localhost.62168 > localhost.18032: UDP, length 40
14:58:56.251219 IP localhost.62168 > localhost.18032: UDP, length 40
14:58:56.251244 IP localhost.62168 > localhost.18032: UDP, length 40
14:58:56.277408 IP localhost.62168 > localhost.18032: UDP, length 40
14:58:56.277520 IP localhost.62168 > localhost.18032: UDP, length 40
14:58:56.302748 IP localhost.62168 > localhost.18032: UDP, length 40
14:58:56.302770 IP localhost.62168 > localhost.18032: UDP, length 40
14:58:56.328006 IP localhost.62168 > localhost.18032: UDP, length 40
14:58:56.328028 IP localhost.62168 > localhost.18032: UDP, length 40
14:58:56.353342 IP localhost.62168 > localhost.18032: UDP, length 40
14:58:56.353369 IP localhost.62168 > localhost.18032: UDP, length 40
14:58:56.378648 IP localhost.62168 > localhost.18032: UDP, length 40
14:58:56.378672 IP localhost.62168 > localhost.18032: UDP, length 40
14:58:56.403856 IP localhost.62168 > localhost.18032: UDP, length 40
14:58:56.403900 IP localhost.62168 > localhost.18032: UDP, length 40
14:58:56.429975 IP localhost.62168 > localhost.18032: UDP, length 40
14:58:56.429998 IP localhost.62168 > localhost.18032: UDP, length 40
14:58:56.455290 IP localhost.62168 > localhost.18032: UDP, length 40
14:58:56.455315 IP localhost.62168 > localhost.18032: UDP, length 40
14:58:56.481131 IP localhost.62168 > localhost.18032: UDP, length 40
14:58:56.481154 IP localhost.62168 > localhost.18032: UDP, length 40
14:58:56.507176 IP localhost.62168 > localhost.18032: UDP, length 40
14:58:56.507211 IP localhost.62168 > localhost.18032: UDP, length 40
14:58:56.533386 IP localhost.62168 > localhost.18032: UDP, length 40
14:58:56.533448 IP localhost.62168 > localhost.18032: UDP, length 40
14:58:56.559164 IP localhost.62168 > localhost.18032: UDP, length 40
14:58:56.559188 IP localhost.62168 > localhost.18032: UDP, length 40
14:58:56.584530 IP localhost.62168 > localhost.18032: UDP, length 40
14:58:56.584554 IP localhost.62168 > localhost.18032: UDP, length 40
14:58:56.610844 IP localhost.62168 > localhost.18032: UDP, length 40
14:58:56.610868 IP localhost.62168 > localhost.18032: UDP, length 40
14:58:56.636154 IP localhost.62168 > localhost.18032: UDP, length 40
14:58:56.636187 IP localhost.62168 > localhost.18032: UDP, length 40
14:58:56.662316 IP localhost.62168 > localhost.18032: UDP, length 40
14:58:56.662339 IP localhost.62168 > localhost.18032: UDP, length 40
14:58:56.703929 IP localhost.62168 > localhost.18032: UDP, length 40
14:58:56.703979 IP localhost.62168 > localhost.18032: UDP, length 40
14:58:56.771249 IP localhost.62168 > localhost.18032: UDP, length 40
14:58:56.771272 IP localhost.62168 > localhost.18032: UDP, length 40
14:58:56.802026 IP localhost.62168 > localhost.18032: UDP, length 40
14:58:56.802053 IP localhost.62168 > localhost.18032: UDP, length 40
14:58:56.828359 IP localhost.62168 > localhost.18032: UDP, length 40
14:58:56.828382 IP localhost.62168 > localhost.18032: UDP, length 40
14:58:56.854095 IP localhost.62168 > localhost.18032: UDP, length 40
14:58:56.854138 IP localhost.62168 > localhost.18032: UDP, length 40
14:58:56.880159 IP localhost.62168 > localhost.18032: UDP, length 40
14:58:56.880182 IP localhost.62168 > localhost.18032: UDP, length 40
14:58:56.906103 IP localhost.62168 > localhost.18032: UDP, length 40
14:58:56.906127 IP localhost.62168 > localhost.18032: UDP, length 40
14:58:56.932192 IP localhost.62168 > localhost.18032: UDP, length 40
14:58:56.932215 IP localhost.62168 > localhost.18032: UDP, length 40
14:58:56.957383 IP localhost.62168 > localhost.18032: UDP, length 40
14:58:56.957406 IP localhost.62168 > localhost.18032: UDP, length 40
14:58:56.983175 IP localhost.62168 > localhost.18032: UDP, length 40
14:58:56.983198 IP localhost.62168 > localhost.18032: UDP, length 40
14:58:57.008512 IP localhost.62168 > localhost.18032: UDP, length 40
14:58:57.008535 IP localhost.62168 > localhost.18032: UDP, length 40
14:58:57.033795 IP localhost.62168 > localhost.18032: UDP, length 40
14:58:57.033819 IP localhost.62168 > localhost.18032: UDP, length 40
14:58:57.059120 IP localhost.62168 > localhost.18032: UDP, length 40
14:58:57.059144 IP localhost.62168 > localhost.18032: UDP, length 40
14:58:57.084408 IP localhost.62168 > localhost.18032: UDP, length 40
14:58:57.084431 IP localhost.62168 > localhost.18032: UDP, length 40
14:58:57.109661 IP localhost.62168 > localhost.18032: UDP, length 40
14:58:57.109689 IP localhost.62168 > localhost.18032: UDP, length 40
